{
  "id": "hotline-pnp-limay",
  "service": "PNP LIMAY",
  "numbers": [
    "0998-598-5361"
  ],
  "category": "police",
  "provenance": {
    "source_name": "Limay emergency hotlines poster",
    "retrieved_at": "2026-09-23",
    "verified": true,
    "verification_note": "Transcribed from the Municipality of Limay emergency hotline poster named in this record's source.",
    "source_document": "Municipality of Limay emergency hotlines poster"
  }
}
