{
  "id": "hotline-limay-command-center",
  "service": "LIMAY COMMAND CENTER",
  "numbers": [
    "0921-798-8042"
  ],
  "category": "disaster",
  "provenance": {
    "source_name": "Limay emergency hotlines poster",
    "retrieved_at": "2026-09-23",
    "verified": true,
    "verification_note": "Transcribed from the Municipality of Limay emergency hotline poster named in this record's source.",
    "source_document": "Municipality of Limay emergency hotlines poster"
  }
}
