[
  {
    "id": "hotline-limay-command-center",
    "service": "LIMAY COMMAND CENTER",
    "numbers": [
      "0921-798-8042"
    ],
    "category": "disaster",
    "provenance": {
      "source_name": "Limay emergency hotlines poster",
      "retrieved_at": "2026-09-23",
      "verified": true,
      "verification_note": "Transcribed from the Municipality of Limay emergency hotline poster named in this record's source.",
      "source_document": "Municipality of Limay emergency hotlines poster"
    }
  },
  {
    "id": "hotline-mdrrmo-lcert",
    "service": "MDRRMO/LCERT",
    "numbers": [
      "0912-005-5676"
    ],
    "category": "disaster",
    "provenance": {
      "source_name": "Limay emergency hotlines poster",
      "retrieved_at": "2026-09-23",
      "verified": true,
      "verification_note": "Transcribed from the Municipality of Limay emergency hotline poster named in this record's source.",
      "source_document": "Municipality of Limay emergency hotlines poster"
    }
  },
  {
    "id": "hotline-304th-2nd-pmfc-bataan",
    "service": "304TH 2ND PMFC BATAAN",
    "numbers": [
      "0917-307-7366"
    ],
    "category": "police",
    "provenance": {
      "source_name": "Limay emergency hotlines poster",
      "retrieved_at": "2026-09-23",
      "verified": true,
      "verification_note": "Transcribed from the Municipality of Limay emergency hotline poster named in this record's source.",
      "source_document": "Municipality of Limay emergency hotlines poster"
    }
  },
  {
    "id": "hotline-forest-guard-cafgu-limay",
    "service": "FOREST GUARD (CAFGU LIMAY)",
    "numbers": [
      "0907-647-2248"
    ],
    "category": "police",
    "provenance": {
      "source_name": "Limay emergency hotlines poster",
      "retrieved_at": "2026-09-23",
      "verified": true,
      "verification_note": "Transcribed from the Municipality of Limay emergency hotline poster named in this record's source.",
      "source_document": "Municipality of Limay emergency hotlines poster"
    }
  },
  {
    "id": "hotline-lamao-security-unit",
    "service": "LAMAO SECURITY UNIT",
    "numbers": [
      "0910-312-6162"
    ],
    "category": "police",
    "provenance": {
      "source_name": "Limay emergency hotlines poster",
      "retrieved_at": "2026-09-23",
      "verified": true,
      "verification_note": "Transcribed from the Municipality of Limay emergency hotline poster named in this record's source.",
      "source_document": "Municipality of Limay emergency hotlines poster"
    }
  },
  {
    "id": "hotline-limay-security-unit",
    "service": "LIMAY SECURITY UNIT",
    "numbers": [
      "0910-237-2138"
    ],
    "category": "police",
    "provenance": {
      "source_name": "Limay emergency hotlines poster",
      "retrieved_at": "2026-09-23",
      "verified": true,
      "verification_note": "Transcribed from the Municipality of Limay emergency hotline poster named in this record's source.",
      "source_document": "Municipality of Limay emergency hotlines poster"
    }
  },
  {
    "id": "hotline-pnp-limay",
    "service": "PNP LIMAY",
    "numbers": [
      "0998-598-5361"
    ],
    "category": "police",
    "provenance": {
      "source_name": "Limay emergency hotlines poster",
      "retrieved_at": "2026-09-23",
      "verified": true,
      "verification_note": "Transcribed from the Municipality of Limay emergency hotline poster named in this record's source.",
      "source_document": "Municipality of Limay emergency hotlines poster"
    }
  },
  {
    "id": "hotline-bfp-limay",
    "service": "BFP LIMAY",
    "numbers": [
      "0999-579-3288"
    ],
    "category": "fire",
    "provenance": {
      "source_name": "Limay emergency hotlines poster",
      "retrieved_at": "2026-09-23",
      "verified": true,
      "verification_note": "Transcribed from the Municipality of Limay emergency hotline poster named in this record's source.",
      "source_document": "Municipality of Limay emergency hotlines poster"
    }
  },
  {
    "id": "hotline-limay-health-center",
    "service": "LIMAY HEALTH CENTER",
    "numbers": [
      "0908-863-9668"
    ],
    "category": "medical",
    "provenance": {
      "source_name": "Limay emergency hotlines poster",
      "retrieved_at": "2026-09-23",
      "verified": true,
      "verification_note": "Transcribed from the Municipality of Limay emergency hotline poster named in this record's source.",
      "source_document": "Municipality of Limay emergency hotlines poster"
    }
  },
  {
    "id": "hotline-ph-coast-guard-limay",
    "service": "PH COAST GUARD (LIMAY)",
    "numbers": [
      "0956-957-1376"
    ],
    "category": "coastguard",
    "provenance": {
      "source_name": "Limay emergency hotlines poster",
      "retrieved_at": "2026-09-23",
      "verified": true,
      "verification_note": "Transcribed from the Municipality of Limay emergency hotline poster named in this record's source.",
      "source_document": "Municipality of Limay emergency hotlines poster"
    }
  },
  {
    "id": "hotline-seaborne-patrol",
    "service": "SEABORNE PATROL",
    "numbers": [
      "0919-002-2896"
    ],
    "category": "coastguard",
    "provenance": {
      "source_name": "Limay emergency hotlines poster",
      "retrieved_at": "2026-09-23",
      "verified": true,
      "verification_note": "Transcribed from the Municipality of Limay emergency hotline poster named in this record's source.",
      "source_document": "Municipality of Limay emergency hotlines poster"
    }
  },
  {
    "id": "hotline-liwad",
    "service": "LIWAD",
    "numbers": [
      "0919-089-9104"
    ],
    "category": "utility",
    "provenance": {
      "source_name": "Limay emergency hotlines poster",
      "retrieved_at": "2026-09-23",
      "verified": true,
      "verification_note": "Transcribed from the Municipality of Limay emergency hotline poster named in this record's source.",
      "source_document": "Municipality of Limay emergency hotlines poster"
    }
  },
  {
    "id": "hotline-penelco-limay",
    "service": "PENELCO LIMAY",
    "numbers": [
      "0917-112-7500"
    ],
    "category": "utility",
    "provenance": {
      "source_name": "Limay emergency hotlines poster",
      "retrieved_at": "2026-09-23",
      "verified": true,
      "verification_note": "Transcribed from the Municipality of Limay emergency hotline poster named in this record's source.",
      "source_document": "Municipality of Limay emergency hotlines poster"
    }
  }
]
